{
  "schema_version": "0.1.0",
  "program_id": "sovereign-ai-os",
  "title": "Sovereign AI OS",
  "snapshot_date": "2026-08-29",
  "canonical_context": "https://github.com/jryski/sovereign-memory-core/blob/main/docs/ecosystem/SOVEREIGN_AI_OS.md",
  "authority_note": "This manifest is an informative, diffable snapshot of the project lead's accepted program direction. Component repositories remain authoritative for their own implementation and evidence. Private deployment state must not be inferred from this public file.",
  "components": [
    {
      "id": "sovereign-memory-protocol",
      "title": "Sovereign Memory Protocol",
      "component_type": "protocol",
      "program_layer": "custody",
      "canonical_locator": {
        "kind": "github-repository",
        "visibility": "private",
        "value": "https://github.com/jryski/sovereign-memory-protocol"
      },
      "role_doc": "https://github.com/jryski/sovereign-memory-protocol/blob/main/PROGRAM-ROLE.md",
      "status_source": "https://github.com/jryski/sovereign-memory-protocol/blob/main/README.md",
      "maturity": "seed",
      "status_as_of": "2026-08-29",
      "owns": [
        "implementation-neutral custody semantics",
        "provenance and authority semantics",
        "lifecycle, correction, conflict, transfer, and conformance contracts"
      ],
      "non_goals": [
        "PostgreSQL implementation",
        "household or business ontology",
        "planning workflow policy",
        "runtime identity or orchestration"
      ],
      "upstream_components": [],
      "downstream_components": [
        "sovereign-memory-core",
        "smp-federated-vault",
        "household-os",
        "sovereign-vault"
      ],
      "consumes_contracts": [],
      "produces_contracts": [
        "smp"
      ],
      "data_classification": "private-no-data-in-git",
      "planning_relationship": "Planning deployments may consume protocol-level provenance and authority semantics, but deployment-specific kanban states, leases, assignments, and synchronization remain outside SMP unless separately generalized and ratified.",
      "evidence_locators": [
        "https://github.com/jryski/sovereign-memory-protocol/blob/main/README.md"
      ],
      "notes": [
        "The repository is currently sparse; maturity reflects the repository content observed on the snapshot date, not the importance of the protocol role."
      ]
    },
    {
      "id": "sovereign-memory-core",
      "title": "Sovereign Memory Core",
      "component_type": "reference-runtime",
      "program_layer": "custody",
      "canonical_locator": {
        "kind": "github-repository",
        "visibility": "public",
        "value": "https://github.com/jryski/sovereign-memory-core"
      },
      "role_doc": "https://github.com/jryski/sovereign-memory-core/blob/main/PROGRAM-ROLE.md",
      "status_source": "https://github.com/jryski/sovereign-memory-core/blob/main/STATUS.md",
      "maturity": "alpha",
      "status_as_of": "2026-08-29",
      "owns": [
        "PostgreSQL reference custody runtime",
        "source preservation and review",
        "promotion, rejection, supersession, and cutover mechanics",
        "migration, validation, recovery, and provider-exit evidence",
        "synthetic adversarial fixtures and tests"
      ],
      "non_goals": [
        "domain-specific household or business tables",
        "permanent principal-bound connection identity",
        "agent runtime and model routing",
        "live organizational planning deployment"
      ],
      "upstream_components": [
        "sovereign-memory-protocol"
      ],
      "downstream_components": [
        "supabase-user-mcp",
        "household-os",
        "household-os-private",
        "sovereign-vault",
        "chat-mine",
        "planning-work-plane",
        "personal-wiki-memory-ui"
      ],
      "consumes_contracts": [
        "smp"
      ],
      "produces_contracts": [
        "core-reference-schema",
        "source-import-package",
        "readiness-scorecard",
        "provider-exit-evidence"
      ],
      "data_classification": "public-synthetic-only",
      "planning_relationship": "Provides reusable provenance, review, evidence, audit, migration, and recovery patterns. Planning remains a separate organizational plane with a different lifecycle.",
      "evidence_locators": [
        "https://github.com/jryski/sovereign-memory-core/blob/main/STATUS.md",
        "https://github.com/jryski/sovereign-memory-core/blob/main/docs/00-north-star.md",
        "https://github.com/jryski/sovereign-memory-core/blob/main/docs/ecosystem/SOVEREIGN_AI_OS.md"
      ],
      "notes": [
        "No privileged database or service-role test should be presented as proof of human or agent connection identity."
      ]
    },
    {
      "id": "supabase-user-mcp",
      "title": "Supabase User MCP",
      "component_type": "access-layer",
      "program_layer": "access",
      "canonical_locator": {
        "kind": "github-repository",
        "visibility": "public",
        "value": "https://github.com/jryski/Supabase_user_MCP"
      },
      "role_doc": "https://github.com/jryski/Supabase_user_MCP/blob/main/PROGRAM-ROLE.md",
      "status_source": "https://github.com/jryski/Supabase_user_MCP/blob/main/docs/ROADMAP.md",
      "maturity": "active-development",
      "status_as_of": "2026-08-29",
      "owns": [
        "trusted human and agent identity propagation",
        "narrow allowlisted data-plane capabilities",
        "revocation, expiry, limits, idempotency, and audit metadata",
        "database-enforced RLS integration",
        "proposal and approval paths for consequential writes"
      ],
      "non_goals": [
        "generic SQL, table, RPC, URL, or REST proxy",
        "project control-plane administration",
        "household or business ontology",
        "agent runtime or model selection"
      ],
      "upstream_components": [
        "sovereign-memory-core"
      ],
      "downstream_components": [
        "household-os",
        "household-os-private",
        "sovereign-vault",
        "planning-work-plane",
        "hermes",
        "personal-wiki-memory-ui",
        "house-deployment",
        "balanceeq-business-deployment"
      ],
      "consumes_contracts": [
        "core-reference-schema",
        "capability-policy-v0.1-proposed",
        "planning-work-plane-v0.1",
        "action-receipt-v0.1-proposed"
      ],
      "produces_contracts": [
        "principal-bound-data-plane",
        "planning-data-plane-profile"
      ],
      "data_classification": "public-synthetic-only",
      "planning_relationship": "Enforces board visibility, claim eligibility, worker/reviewer separation, revocation, expiry, and bounded planning tools for both household and business deployments.",
      "evidence_locators": [
        "https://github.com/jryski/Supabase_user_MCP/blob/main/README.md",
        "https://github.com/jryski/Supabase_user_MCP/blob/main/docs/PLANNING_DATA_PLANE_PROFILE.md"
      ],
      "notes": [
        "M0 is active and is not a production data server on the snapshot date.",
        "The hosted Supabase MCP remains the separate privileged build/control plane."
      ]
    },
    {
      "id": "household-os",
      "title": "Household OS",
      "component_type": "deployment-reference",
      "program_layer": "domain",
      "canonical_locator": {
        "kind": "github-repository",
        "visibility": "public",
        "value": "https://github.com/jryski/Household-OS"
      },
      "role_doc": "https://github.com/jryski/Household-OS/blob/main/PROGRAM-ROLE.md",
      "status_source": "https://github.com/jryski/Household-OS/blob/main/README.md",
      "maturity": "early-architecture",
      "status_as_of": "2026-08-29",
      "owns": [
        "public household-domain architecture",
        "household entity, relationship, observation, event, and capability profiles",
        "family planning and virtual-kanban profile",
        "connector observation and reconciliation contracts",
        "synthetic household fixtures and policy examples"
      ],
      "non_goals": [
        "real household data",
        "business ontology",
        "protocol or Core redefinition",
        "runtime identity implementation",
        "model routing"
      ],
      "upstream_components": [
        "sovereign-memory-protocol",
        "sovereign-memory-core",
        "supabase-user-mcp",
        "planning-work-plane"
      ],
      "downstream_components": [
        "household-os-private",
        "house-deployment",
        "personal-wiki-memory-ui",
        "hermes"
      ],
      "consumes_contracts": [
        "smp",
        "core-reference-schema",
        "principal-bound-data-plane",
        "context-envelope-v0.1-proposed",
        "capability-policy-v0.1-proposed",
        "planning-work-plane-v0.1",
        "connector-observation-v0.1-proposed",
        "action-receipt-v0.1-proposed"
      ],
      "produces_contracts": [
        "household-domain-profile",
        "household-planning-profile"
      ],
      "data_classification": "public-synthetic-only",
      "planning_relationship": "Owns the household-specific profile for family projects, school, activities, events, chores, maintenance, purchases, errands, and household agent coordination.",
      "evidence_locators": [
        "https://github.com/jryski/Household-OS/blob/main/README.md",
        "https://github.com/jryski/Household-OS/blob/main/docs/PLANNING_WORK_PLANE.md"
      ],
      "notes": [
        "Shared household coordination belongs in HOUSE; principal-private annotations belong in the relevant principal trust domain."
      ]
    },
    {
      "id": "household-os-private",
      "title": "Household OS Private",
      "component_type": "deployment-overlay",
      "program_layer": "deployment",
      "canonical_locator": {
        "kind": "github-repository",
        "visibility": "private",